Date Reported,Company,Product,Reason,Severity Class,Status,State
20260624,Keystone Industries,"Quala Dental Products, Topical Anesthetic Gel, 20 % Benzocaine, Strawberry Flavor Net Contents: 1 oz (30 g), Quala Dental Products, Made in USA for NDC Inc., 407 Sanford Road, Le Vergne, TN 37086, NDC 43128-034-30.",Defective container:may contain bottles with incomplete seals,Class II,Ongoing,NJ
20260624,Dabur India Limited,"Lucky Super Soft, Antifungal Athlete's Foot Cream, Clotrimazole 1% Cream, Net Wt. 1.5 oz (42.5g) Tubes, Manufactured for Delta Brands Inc., 580 White Plains Rd., Tarrytown, NY 10591 USA, Made in India, UPC 8 08829 10461 5.",CGMP Deviations; deficiencies observed during FDA inspection,Class II,Ongoing,
20260624,Dabur India Limited,"Med Pride, HYDROCORTISONE CREAM 1%, Net Wt. 16oz (454g) tubes, Manufactured for: Shield Line LLC, 59 Hook Road, Bayonne, NJ 07002 USA, Made in India, UPC 3 52410 305061.",CGMP Deviations; deficiencies observed during FDA inspection,Class II,Ongoing,
20260624,Dabur India Limited,"Med Pride, Bacitracin Zinc Ointment, 500 units, 1oz (28.3g) tubes, Manufactured for: Shield Line LLC, 59 Hook Road, Bayonne, NJ 07002 USA, Made in India, UPC 3 52410 30354 8.",CGMP Deviations; deficiencies observed during FDA inspection,Class II,Ongoing,
20260624,PAI Holdings LLC,"VistaPharm, KERR INSTA-CHAR IN AN AQUEOUS BASE WITH CHERRY FLAVOR, 50 Grams Activated Charcoal in 240 ml (8 fl oz), distributed by: VistaPharm, Inc., Largo. FL 33771, NDC 66689-202-08.",Does Not Meet USP or OTC Monograph: Product did not meet the Over-the-Counter (OTC) Monograph M023,Class II,Ongoing,SC
20260624,PAI Holdings LLC,"VistaPharm, KERR INSTA-CHAR IN AN SORBITOL BASE WITH CHERRY FLAVOR, 25 Grams Activated Charcoal in 26 Grams Sorbitol in 120 mL (4 fl oz), distributed by: VistaPharm, Inc., Largo. FL 33771, NDC 66689-203-04.",Does Not Meet USP or OTC Monograph: Product did not meet the Over-the-Counter (OTC) Monograph M023,Class II,Ongoing,SC
20260624,PAI Holdings LLC,"VistaPharm, KERR INSTA-CHAR IN AN AQUEOUS BASE WITH CHERRY FLAVOR, 25 Grams Activated Charcoal in 120 ml (4 fl oz), distributed by: VistaPharm, Inc., Largo. FL 33771, NDC 66689-202-04.",Does Not Meet USP or OTC Monograph: Product did not meet the Over-the-Counter (OTC) Monograph M023,Class II,Ongoing,SC
20260624,Ajanta Pharma USA Inc,"Aripiprazole Tablets USP, Rx only, 30 mg, 30 tablets, Marketed by: Ajanta Pharma USA Inc., Bridgewater, NJ 08807, Made in India, NDC 27241-056-03.",Product Mix-Up:  A bottle containing Voriconazole Tablets 50 mg was labelled and distributed as Aripiprazole Tablets USP 30 mg.,Class II,Ongoing,NJ
20260624,Keystone Industries,"Burkhart topical anesthetic gel, benzocaine 20 %, Strawberry Flavor, 1 oz (30 mL), Manufactured for Burkhart Dental Supply, Tacoma, Washington, 98409. NDC: 43498-310-30",Defective container:may contain bottles with incomplete seals,Class II,Ongoing,NJ
20260624,Keystone Industries,"Dental City TOPICAL ANESTHETIC GEL,  BENZOCAINE 20%, Strawberry Flavor, 1 OZ (30 g), Distributed by Dental City, 3205 Yeager Dr., Green Bay, WI 54311. NDC 69483-001-30",Defective container:may contain bottles with incomplete seals,Class II,Ongoing,NJ
20260624,Dabur India Limited,"Lil Drug Store, Triple Antibiotic Ointment, Bacitracin Zinc (400 units), Neomycin Sulfate (3.5 mg), Polymyxin-B Sulfate (5000 units), net wt. 0.5 oz (14.2g), Product distributed by: Lil' Drug Store Products, Inc., 9300 Earhart Lane SW, Cedar Rapids, IA 52404, Made in India, UPC 3 66715 97310 8.",CGMP Deviations; deficiencies observed during FDA inspection,Class II,Ongoing,
20260624,Keystone Industries,"safco SensiCaine-Ultra (20% Benzocaine), Topical Anesthetic Gel, Strawberry Flavor, 1 oz. (29.6mL),   Distributed by: Safco Dental Supply Co., Buffalo Grove, IL 60099, Made in USA, NDC 67239-0223-1.",Defective container:may contain bottles with incomplete seals,Class II,Ongoing,NJ
20260624,Dabur India Limited,"Med Pride, 1% Clotrimazole Antifungal Cream, Net Wt. 1oz (28.3g), Manufactured for: Shield Line LLC, 59 Hook Road, Bayonne, NJ 07002 USA, Made in India, UPC 3 524103 0244 2.",CGMP Deviations; deficiencies observed during FDA inspection,Class II,Ongoing,
20260624,Sandoz Inc,"Focalin XR (dexmethylphenidate HCl) 5 mg, 30 extended-release capsules per bottle, Rx only, Manufactured by Societal CDMO Gainesville, LLC, Gainesville, GA 30504.  NDC: 66758-235-31",Labeling: Incorrect or Missing Lot and/or Exp Date,Class III,Ongoing,NJ
20260624,Dabur India Limited,"Med Pride, Triple Antibiotic Ointment, Bacitracin Zinc 400 units, Neomycin Sulfate 5 mg, Polymyxin B 5000 units, 1oz (28.3g) tubes, Manufactured for: Shield Line LLC, 59 Hook Road, Bayonne, NJ 07002 USA, Made in India, UPC 3 52410 30255 8.",CGMP Deviations; deficiencies observed during FDA inspection,Class II,Ongoing,
20260624,"Glenmark Pharmaceuticals Inc., USA","Alyacen 7/7/7, Norethindrone and Ethinyl Estradiol Tablets USP, 0.5mg/0.035mg, 0.75mg/0.035mg, 1 mg/0.0.35mg, 3 Blister Cards each containing 28 tablets, 28 day regimen, Rx only, Manufactured by: Glenmark Pharmaceuticals Ltd., Colvale-Bardez, Goa 403 513, India, Manufactured for: Glenmark Pharmaceuticals Inc., Mahwah, NJ 07430, NDC 68462-556-29",Failed Impurities/Degradation Specifications: This recall is being initiated due to out-of-specification results total impurities.,Class II,Ongoing,NJ
20260624,Dabur India Limited,"Circle K, triple antibiotic ointment, Bacitracin Zinc (400 units), Neomycin Sulfate (3.5 mg), Polymyxin-B Sulfate (5000 units), net wt. 0.5 oz (14.2g) tubes, Product manufactured for Lil' Drug Store Products, Inc., 9300 Earhart Lane SW, Cedar Rapids, IA 52404, Made in India, UPC 1 94283 65181 0.",CGMP Deviations; deficiencies observed during FDA inspection,Class II,Ongoing,
20260624,"Par Health USA, LLC","Buprenorphine HCl, CIII, Injection, 0.3 mg/mL, 5 x 1 mL Single Dose Vials per Carton, Rx Only, For Intramuscular or Intravenous use, Manufactured for: Endo USA, Malvern, PA 19355,  NDC 42023-179-05",Crystallization; identified as Buprenorphine free base,Class II,Ongoing,MI
20260624,Keystone Industries,"Pearson Quality Topical Anesthetic Gel (20% Benzocaine), Mint Flavor, Net Contents: 1 oz (3o g), Manufactured for: Pearson Dental Supply Inc., Sylmar, CA 91342 USA, NDC 43305-0009-3.",Defective container:may contain bottles with incomplete seals,Class II,Ongoing,NJ
20260624,PAI Holdings LLC,"VistaPharm, KERR INSTA-CHAR IN AN SORBITOL BASE WITH CHERRY FLAVOR, 50 Grams Activated Charcoal in 52 Grams Sorbitol in 240 mL (8 fl oz), distributed by: VistaPharm, Inc., Largo. FL 33771, NDC 66689-203-08.",Does Not Meet USP or OTC Monograph: Product did not meet the Over-the-Counter (OTC) Monograph M023,Class II,Ongoing,SC
20260624,Dabur India Limited,"Cura Hongos, Crema Antifungica, Clotrimazole 1%, 2oz (57g) tubes, Dist by/por: Pharmadel LLC, New Castle, DE 19720, Made in India, UPC 8 52924 00683 1.",CGMP Deviations; deficiencies observed during FDA inspection,Class II,Ongoing,
20260624,Dabur India Limited,"Med Pride, Bacitracin Zinc Ointment, 500 units, 0.9g packets Net Wt 130g, 144 count box, Manufactured for: Shield Line LLC, 59 Hook Road, Bayonne, NJ 07002 USA, Made in India, UPC 3 52410 30352 4.",CGMP Deviations; deficiencies observed during FDA inspection,Class II,Ongoing,
20260617,"Ascend Laboratories, LLC","Minocycline Hydrochloride Extended-Release Tablets, USP, 115 mg, 30-count bottle, Rx Only, Manufactured by: Alkem Laboratories Ltd., INDIA. Distributed by: Ascend Laboratories, LLC, Parsippany, NJ 07054.  NDC: 67877-644-30",Failed Dissolution Specifications: An out-of-specification (OOS) result was observed during the 9th month of dissolution test analysis,Class II,Ongoing,NJ
20260617,Haleon US Holdings LLC,"Gas-X Extra Strength, SIMETHICONE 125 mg/ANTIGAS, packaged in a) 120 SoftGels (UPC 3 00674 35041 9, b) 72 SoftGels (UPC 3 00439 00572 1), Distributed by: Haleon, Warren, NJ 07059.",Chemical Contamination: contamination with a diluted propylene glycol-based coolant from a machine leakage during the packaging process.,Class I,Ongoing,NJ
20260617,BEEKEEPER'S NATURALS USA INC.,"BEEKEEPER'S NATURALS Saline Nasal Spray, Sinus Congestion Rinse, Made with Propolis + Xylitol, 1 FL OZ (30 mL) per bottle, Manufactured For:  Beekeeper's Naturals USA Inc., Covina, CA 91789.",Microbial Contamination of Non-Sterile Products,Class I,Ongoing,CA
20260617,SUN PHARMACEUTICAL INDUSTRIES INC,"Budesonide Inhalation Suspension, 1mg/2mL, 30 x 2 mL Sterile Single-Dose Ampules (5 Single-Dose Ampules per pouch, 6 pouches per carton, Distributed by: Sun Pharmaceutical Industries, Inc., Cranbury, NJ 08512, Manufactured by: Sun Pharmaceutical Industries Limited, Baska Ujeti Road, Ujeti Halol-289350, Gujarat, India, NDC 47335-633-49.",Presence of Foreign Substance:This recall has been initiated in response to a product quality complaint reported for black/brown specs and particles within the ampoule solution,Class II,Ongoing,NJ
20260617,Zep Inc,"Zep, Alcohol Sanitizer Spray, Ethanol 70%, Net Contents 55 Gallons 208 Liters, Made in USA, A Zep Inc. Brand, Distributed by: Zap Inc., 350 Joe Frank Harris Parkway, SE, Emerson, GA 30137, NDC 66949-133-85.",Microbial contamination of sterile products,Class II,Ongoing,GA
20260617,"Breckenridge Pharmaceutical, Inc.","Duloxetine Delayed-Release Capsules, USP, 60mg, packaged in a) 90 Capsules (NDC 51991-748-90); b) 1000 Capsules (51991-748-10), Rx Only, Mfr. by: Towa Pharmaceutical Europe, S.L. Martorelles, (Barcelona), Spain, Dist. by: Breckenridge Pharmaceuticals, Inc., Berkeley Heights, NJ 07922.",CGMP Deviations: Presence of N-nitroso-duloxetine impurity above FDA recommended interim limit,Class II,Ongoing,NJ
20260617,"Fresenius Kabi USA, LLC","Epinephrine Injection, USP, 1mg/mL, 1 mL single-dose vial, Rx only, Fresenius Kabi, Lake Zurich, IL 60047, NDC 63323-696-02 (vial), NDC 63323-696-25 (carton)",Failed Impurities/Degradations Specifications,Class III,Ongoing,IL
